{
  "answer_id": "ans_01K47P8K6YJ7KX8C2A5QK91R2Z",
  "safe_summary": "The answer used the authorized sales snapshot and grouped account ARR by region.",
  "executed_query_plan": {
    "schema_versions": {
      "sales-analytics": "2.3.0"
    },
    "domains": ["sales-analytics"],
    "group_by": ["sales.Account.region"],
    "aggregations": [
      {
        "measure": "sales.Account.arr",
        "function": "sum",
        "as": "total_arr"
      }
    ],
    "consistency": "snapshot"
  },
  "routing": {
    "reuse": "new",
    "domains": ["sales-analytics"],
    "plan_digest": "sha256:9d7c",
    "safe_rationale": "The typed plan selected the sales analytics domain."
  },
  "source_statuses": [
    {
      "source_system": "warehouse",
      "domain_id": "sales-analytics",
      "status": "success",
      "required": true,
      "as_of": "2026-09-01T12:45:00Z",
      "retrieved_at": "2026-09-01T13:00:05Z",
      "latency_ms": 410
    }
  ],
  "conflicts": [],
  "created_at": "2026-09-01T13:00:06Z"
}
